{
  "schema_version": "v1",
  "claim_id": "0190f5c2-7c1e-7ad2-8def-1234567890ab",
  "space_id": "0190f5c2-7c1e-7ac0-8def-1234567890ab",
  "correlation_id": "0190f5c2-7c1e-7abe-8def-1234567890ab",
  "run_id": "0190f5c2-7c1e-7ac1-8def-1234567890ab",
  "claim_text": "RAGForge 将 Evidence Bundle 中的 evidence_id 作为唯一结构化引用标识。",
  "citation_tokens": ["0190f5c2-7c1e-7ad3-8def-1234567890ab"]
}
